{
  "schema_version": 1,
  "checked_on": "2026-10-21",
  "title": "British Standards updates and revisions",
  "categories": {
    "fire": "Fire alarms and evacuation",
    "fire-safety": "Building fire safety",
    "emergency-lighting": "Emergency lighting",
    "security": "Intruder alarms and monitoring",
    "access-control": "Access control and door entry",
    "cctv": "CCTV and video",
    "electrical": "Electrical and cabling"
  },
  "coverage": {
    "complete": false,
    "scope": "British Standards and UK-adopted EN/IEC standards relevant to this fire and security manual archive, with supporting lighting, electrical and building-fire-safety references. PD 6662 and PD 6669 are explicitly labelled companion Published Documents.",
    "limits": [
      "This is a checked register, not a complete catalogue of every British Standard or every historical amendment.",
      "Edition headings and publisher statuses are verified against public BSI records. Detailed changes are summarized only where the publisher supplies a public summary.",
      "An A-number in a designation records that amendment; it is not a complete list of earlier amendments or separate corrigenda.",
      "A publisher record date can refer to a corrected issue or product record and can differ from the year in the designation. It is not an effective or withdrawal date.",
      "Under review does not mean withdrawn. Drafts do not replace published standards. A newer edition does not establish a withdrawal date for an earlier one.",
      "Full standard texts require the publisher licence. Offline search stores this metadata and these original short summaries, not licensed standards PDFs."
    ],
    "remaining_checks": [
      "Complete amendment, corrigendum and supersession histories from publisher history panels or licensed copies, especially EN 54 product standards.",
      "Remaining EN 54 parts and PD CEN/TS application guides; remaining EN 50131 detector/application parts and EN 50130 environmental/EMC standards.",
      "Remaining EN 60839 and EN 62820 application/interoperability parts; remaining EN 62676 protocol parts.",
      "Supporting structured-cabling, social-alarm, fire-suppression and powered-gate references beyond the entries checked here.",
      "Formal withdrawal/coexistence dates where BSI still shows both earlier and newer records as current; do not infer a deadline."
    ]
  },
  "records": [
    {
      "id": "bs-en-1125-2008",
      "standard": "BS EN 1125",
      "edition": "BS EN 1125:2008",
      "title": "Panic exits with horizontal bars",
      "category": "access-control",
      "status": "current",
      "under_review": true,
      "publisher_status": "Current, Under Review",
      "publisher_record_date": "2008-03-31",
      "source_checked": "2026-10-21",
      "source_url": "https://knowledge.bsigroup.com/products/building-hardware-panic-exit-devices-operated-by-a-horizontal-bar-for-use-on-escape-routes-requirements-and-test-methods",
      "source_urls": [
        "https://knowledge.bsigroup.com/products/building-hardware-panic-exit-devices-operated-by-a-horizontal-bar-for-use-on-escape-routes-requirements-and-test-methods"
      ],
      "amendments_in_designation": [],
      "update_kind": "edition-recorded",
      "change_summary": null,
      "summary_basis": "edition-metadata-only",
      "supersedes": [],
      "earlier_records": [],
      "transition": null,
      "notes": [],
      "history_complete": false,
      "access": "publisher-link-only"
    },
    {
      "id": "bs-en-12453-2017-a1-2021",
      "standard": "BS EN 12453",
      "edition": "BS EN 12453:2017+A1:2021",
      "title": "Industrial, commercial and garage doors and gates. Safety in use of power operated doors. Requirements and test methods",
      "category": "access-control",
      "status": "current",
      "under_review": false,
      "publisher_status": "Current",
      "publisher_record_date": "2023-04-30",
      "source_checked": "2026-10-21",
      "source_url": "https://knowledge.bsigroup.com/products/industrial-commercial-and-garage-doors-and-gates-safety-in-use-of-power-operated-doors-requirements-and-test-methods-2",
      "source_urls": [
        "https://knowledge.bsigroup.com/products/industrial-commercial-and-garage-doors-and-gates-safety-in-use-of-power-operated-doors-requirements-and-test-methods-2"
      ],
      "amendments_in_designation": [
        "A1:2021"
      ],
      "update_kind": "amendment",
      "change_summary": null,
      "summary_basis": "edition-metadata-only",
      "supersedes": [],
      "earlier_records": [
        {
          "edition": "BS EN 12453:2017",
          "publisher_status": "Current, Under Review",
          "source_url": "https://knowledge.bsigroup.com/products/industrial-commercial-and-garage-doors-and-gates-safety-in-use-of-power-operated-doors-requirements-and-test-methods",
          "note": "Earlier publisher record; status is reproduced as checked, not inferred from the existence of a newer edition."
        }
      ],
      "transition": null,
      "notes": [
        "An earlier publisher record also reports current status. No withdrawal date or transition deadline is inferred."
      ],
      "history_complete": false,
      "access": "publisher-link-only"
    },
    {
      "id": "bs-en-13637-2015",
      "standard": "BS EN 13637",
      "edition": "BS EN 13637:2015",
      "title": "Electrically controlled escape-route exits",
      "category": "access-control",
      "status": "current",
      "under_review": true,
      "publisher_status": "Current, Under Review",
      "publisher_record_date": "2022-09-30",
      "source_checked": "2026-10-21",
      "source_url": "https://knowledge.bsigroup.com/products/building-hardware-electrically-controlled-exit-systems-for-use-on-escape-routes-requirements-and-test-methods-1",
      "source_urls": [
        "https://knowledge.bsigroup.com/products/building-hardware-electrically-controlled-exit-systems-for-use-on-escape-routes-requirements-and-test-methods-1"
      ],
      "amendments_in_designation": [],
      "update_kind": "edition-recorded",
      "change_summary": null,
      "summary_basis": "edition-metadata-only",
      "supersedes": [],
      "earlier_records": [],
      "transition": null,
      "notes": [],
      "history_complete": false,
      "access": "publisher-link-only"
    },
    {
      "id": "bs-en-14846-2008",
      "standard": "BS EN 14846",
      "edition": "BS EN 14846:2008",
      "title": "Building hardware. Locks and latches. Electromechanically operated locks and striking plates. Requirements and test methods",
      "category": "access-control",
      "status": "current",
      "under_review": true,
      "publisher_status": "Current, Under Review",
      "publisher_record_date": "2009-03-31",
      "source_checked": "2026-10-21",
      "source_url": "https://knowledge.bsigroup.com/products/building-hardware-locks-and-latches-electromechanically-operated-locks-and-striking-plates-requirements-and-test-methods",
      "source_urls": [
        "https://knowledge.bsigroup.com/products/building-hardware-locks-and-latches-electromechanically-operated-locks-and-striking-plates-requirements-and-test-methods"
      ],
      "amendments_in_designation": [],
      "update_kind": "edition-recorded",
      "change_summary": null,
      "summary_basis": "edition-metadata-only",
      "supersedes": [],
      "earlier_records": [],
      "transition": null,
      "notes": [],
      "history_complete": false,
      "access": "publisher-link-only"
    },
    {
      "id": "bs-en-16005-2023-a1-2024",
      "standard": "BS EN 16005",
      "edition": "BS EN 16005:2023+A1:2024",
      "title": "Power operated pedestrian doorsets. Safety in use. Requirements and test methods",
      "category": "access-control",
      "status": "current",
      "under_review": false,
      "publisher_status": "Current",
      "publisher_record_date": "2024-11-30",
      "source_checked": "2026-10-21",
      "source_url": "https://knowledge.bsigroup.com/products/power-operated-pedestrian-doorsets-safety-in-use-requirements-and-test-methods-3",
      "source_urls": [
        "https://knowledge.bsigroup.com/products/power-operated-pedestrian-doorsets-safety-in-use-requirements-and-test-methods-3"
      ],
      "amendments_in_designation": [
        "A1:2024"
      ],
      "update_kind": "amendment",
      "change_summary": null,
      "summary_basis": "edition-metadata-only",
      "supersedes": [],
      "earlier_records": [
        {
          "edition": "BS EN 16005:2023",
          "publisher_status": "Current",
          "source_url": "https://knowledge.bsigroup.com/products/power-operated-pedestrian-doorsets-safety-in-use-requirements-and-test-methods-2",
          "note": "Earlier publisher record; status is reproduced as checked, not inferred from the existence of a newer edition."
        }
      ],
      "transition": null,
      "notes": [
        "An earlier publisher record also reports current status. No withdrawal date or transition deadline is inferred."
      ],
      "history_complete": false,
      "access": "publisher-link-only"
    },
    {
      "id": "bs-en-179-2008",
      "standard": "BS EN 179",
      "edition": "BS EN 179:2008",
      "title": "Emergency exits with handles or push pads",
      "category": "access-control",
      "status": "current",
      "under_review": false,
      "publisher_status": "Current",
      "publisher_record_date": "2008-03-31",
      "source_checked": "2026-10-21",
      "source_url": "https://knowledge.bsigroup.com/products/building-hardware-emergency-exit-devices-operated-by-a-lever-handle-or-push-pad-for-use-on-escape-routes-requirements-and-test-methods",
      "source_urls": [
        "https://knowledge.bsigroup.com/products/building-hardware-emergency-exit-devices-operated-by-a-lever-handle-or-push-pad-for-use-on-escape-routes-requirements-and-test-methods"